source,title,description,text,url,publishedAt,emotion,summary
Thegatewaypundit.com,Legal Immigrant from Africa Has Message for Spoiled Protesting Leftists: How can you hate one man just because he love his country? (Video),,"Leftists across the country, many of whom are Boomers trying to relive their glory days of the 60s, continue to protest against Donald Trumps efforts to Make America Great Again. While they lecture us to believe all women, they shout about bringing back a man who woke up in the middle of the night to slap his wife. They shout about DOGE finding diabolical waste of taxpayers hard earned money across every component of the federal government because, apparently, they want the waste. A legal immigrant from Africa, whose name is Fayz, had strong words for spoiled protestors and their endless public tantrums. Fayz shared, Ive never seen such hate in a country like America. The way they hate only one man. Americans have been spoiled, and they think that the more they make noise, the more they get things done. To get things done, calls for what? Pragmatic assessment on how youre going to get things done. Not this wasting of time and just protesting somebody who loves this country. In my life, Ive never seen such hate in a country like America, the way they hate only one man. How is that possible? How can you hate one man just because he love his country? What is this? I travel all the way from Africa to come to this country legally to make sure I realize the American dream. My kids are born here. Watch: Immigrant from Africa argues with democrats at a protest (part4) #Trump #Maga pic.twitter.com/nl3BJFc4l1 Never Woke (@NeverWokeX) May 5, 2025 Fayz spent some time arguing with the leftist protestors who, as expected, didnt want to hear his perspective. (Part one) Immigrant from Africa argues with democrats at a protest (part1) #Trump #Maga pic.twitter.com/mTZOtIYa3F Never Woke (@NeverWokeX) May 5, 2025 What you are doing is just sheer waste of time! (Part two) Immigrant from Africa argues with democrats at a protest (part2) #Trump #Maga pic.twitter.com/hMqnil7zsa Never Woke (@NeverWokeX) May 5, 2025 America is the greatest country on earth. (Part three)",https://www.thegatewaypundit.com/2025/05/legal-immigrant-africa-has-message-spoiled-protesting-leftists/,2025-05-05 16:15:33+00:00,anger,"A legal immigrant from Africa, whose name is Fayz, had strong words for spoiled protestors and their endless public tantrums. Fayz shared, Ive never seen such hate in a country like America. The way they hate only one man. Americans have been spoiled. To get things done, calls for what? Pragmatic assessment on how youre going to get thingsdone. Not this wasting of time and just protesting somebody who loves this country."
Washingtonspectator.org,"Americas Slide into Authoritarianism, as seen from TED 2025",,"Historians (if they exist in the future and any records of this period survive) will note this month as one where the United States slipped fully into authoritarianism. Incompetence, luck, and real leadership may yet intervene, but we have already crossed several red lines warned about by experts. At the TED conference this past week in Vancouver, British Columbia, about 1,700 multidisciplinary thinkers gathered to hear and discuss dozens of prepared talks. But the real action was among the attendees, who gathered all week in impromptu salon discussions to share their concerns about the state of the world and what can be done to change course. Here are some of the most discussed topics and themes. Its a Coup Carole Cadwalladr, a journalist who has reported on tech overreach and the rise of data-driven authoritarianism, delivered a powerful talk in which she correctly stated what many are afraid to admit: Its a coup. The purchase of an American president (and American sovereignty) by Elon Musk is unprecedented, and it appears to be advancing unabated. In her conference-opening talk, she also confronted OpenAI CEO Sam Altman about the theft of her intellectual property to train the companys AI systems. When TEDs Chris Anderson brought up this concern with Altman in an interview during the final conference session (with Cadwalladr applauding) Altmans response directed to her was, Clap all you want to about that. Enjoy. When Cadwalladr confronted him again privately backstage, he waved her off, citing fair use. While the TED community is comprised of a wide range of people, a broad majority of participants appeared to align with Cadwalladr, agreeing that AI companies are overreaching, and violating property laws. Shortly after the interview with Altman, Twitter cofounder Jack Dorsey seemed to offer support for Altmans view, posting delete all ip law on X, with Elon Musk replying, I agree. Crossing the Rubicon into Authoritarianism In the course of just a few days, Americans have cataloged a laundry list of signs that the country has reached a tipping point into authoritarianism: SignalGate; Liberation Day tariffs; reversal of (some) tariffs (maybe); deportations to El Salvador; defiance of the Supreme Court; asserting that home growns (aka citizens) are next; taking control of Columbia University by placing it into receivership; bullying law firms to provide pro-bono services supportive of the regime; indiscriminate revocation of student visas; calling for the revocation of the broadcast license for CBS over dislike of 60 Minutes content; attempts to criminalize media figures like Norm Eisen; investigation of former Trump administration officials Miles Taylor and Chris Krebs on grounds of treason; forcing Americans to use X to interact with the Social Security administration; widespread DOGE cuts of programs and agencies without Congressional approval; decline of the dollar under pressure from tariffs and market chaos. The list goes on and on. People",https://washingtonspectator.org/americas-slide-into-authoritarianism-as-seen-from-ted-2025/,2025-04-16 00:00:00,neutral,"Incompetence, luck, and real leadership may yet intervene, but we have already crossed several red lines warned about by experts. Carole Cadwalladr, a journalist who has reported on tech overreach and the rise of data-driven authoritarianism, delivered a powerful talk in which she correctly stated what many are afraid to admit: Its a coup. The purchase of an American president (and American sovereignty) by Elon Musk is unprecedented. The real action was among the attendees who gathered all week in impromptu salon discussions."
New York Post,Elon Musks security guards at Fort Knox Texas compound called cops on neighbor they thought was naked: report,,"High fences make bad neighbors. At least thats what those living near Elon Musks Fort Knox high-walled compound near Austin, Texas, claim including allegations that the moguls security forces called the cops on one neighbor for allegedly standing naked in the street. Paul Hemmer, a retired real estate agent and head of the neighborhood homeowners association in West Lake Hills, has been among the most vocal residents complaining about Musks alleged zoning code violations. 4 Elon Musk reportedly converted his suburban Austin mansion into his own Fort Knox. REUTERS He told the New York Times that he has been under constant surveillance from Musks security cameras, which were installed on the grounds of a property that the billionaire mogul purchased with the intention of merging with two other adjacent lots to serve as a compound for him, his 13 kids and their mothers. I call that place Fort Knox, Hemmer told the Times. Last year, Musks security team accused Hemmer of indecent behavior, alleging he was nude outside his home. Hemmer denied that he was naked and said he was on his property wearing black underwear. On another occasion, Hemmer stopped to urinate while walking his dog which Musks security surveillance captured. The cameras got me, Hemmer told the Times. Its scary they have guys sitting and watching me pee. 4 West Lake Hills, Texas is an affluent suburb of Austin not far from the banks of the Colorado River. Getty Images/iStockphoto Hemmers outrage at Musk prompted him to fly a video-equipped drone over his property in a bid to document alleged violations, the Times reported. Hemmer and other residents of an upscale cul-de-sac in West Lake Hills, an affluent suburb just west of Austin, launched a formal complaint against Musk after he moved in to their neighborhood in 2022. The worlds richest man whose portfolio of companies includes Tesla, SpaceX, X and Neuralink, purchased the $6 million, 6,900-square-foot mansion through a limited liability company. Musks arrival in the neighborhood, however, was anything but subtle as neighbors soon observed unsettling changes, the Times reported. Workers installed a towering 16-foot chain-link fence around the property significantly exceeding local height restrictions accompanied by outward-facing surveillance cameras. The fence is 10 feet higher than zoning ordinances permit, according to the Times. Traffic congestion soon became another sore point. Residents noted fleets of vehicles, particularly Teslas, routinely parked on their previously serene streets. Security personnel, identifiable by their firearm holsters, changed shifts three times daily, adding to neighborhood frustrations, according to the Times. The scale of the construction also violated at least six city ordinances, the Times reported. Musks representatives sought to retroactively gain permission for the various construction projects in and around the property, but were denied last month, according to the outlet. 4 Musk has reported",https://nypost.com/2025/05/05/business/elon-musks-security-guards-called-cops-on-neighbor-they-thought-was-naked/,2025-05-05 00:00:00,disgust,"Elon Musk reportedly converted his suburban Austin mansion into his own Fort Knox. Paul Hemmer, a retired real estate agent and head of the neighborhood homeowners association in West Lake Hills, has been among the most vocal residents complaining about Musks alleged zoning code violations. Last year, Musks security team accused Hemmer of indecent behavior, alleging he was nude out in the street. He told the New York Times that he has been under constant surveillance fromMusks security cameras."
Newser,Musk's Most Important Mission Isn't DOGE or EVs,,"Elon Musk is shifting away from DOGE to refocus on Tesla, and James Pethokoukis writes in a Washington Post essay that it can't happen soon enough. The reason is not because of politics or even electric cars. Pethokoukis, a senior fellow at the American Enterprise Institute, makes the case that it's essential Musk return to Tesla because ""the company's future, and perhaps the world's, rests on building a different product: the perfect robot."" Tesla is working on a prototype of a humanoid robot called Optimus, and Musk has predicted that much of Tesla's future value rests on it. And yes, Musk loves to over-hype things, but Pethokoukis agrees with the sentiment that humanoid robots are on the cusp of changing the world, much in the same way smartphones have.",https://www.newser.com/story/368171/musks-most-important-mission-isnt-doge-or-evs.html,2025-05-05 15:28:00-05:00,neutral,Elon Musk is shifting away from DOGE to refocus on Tesla. James Pethokoukis says it can't happen soon enough. Tesla is working on a prototype of a humanoid robot.
The Daily Caller,Prosecutor Who Let Tesla Vandal Off Easy Now Under DOJ Probe For Race-Based Policy,,"The Department of Justice (DOJ) is looking into whether a Minnesota prosecutors office is violating the Constitution by pledging to factor defendants skin color into plea deals. Assistant Attorney General for Civil Rights Harmeet Dhillon announced on Saturday that the DOJ will review the new policy at Hennepin County Attorney Mary Moriartys office to see whether the [office] is engaged in a pattern or practice of depriving persons of rights, as described in a letter to Hennepin County. The probe adds to ongoing scrutiny of Moriartys policies since she came into the spotlight in April for refusing to prosecute a state official who vandalized Tesla vehicles. This week we @TheJusticeDept @CivilRights opened a racial discrimination pattern and practice investigation into Hennepin County, Minnesotas recently announced policy of taking race into consideration in plea offers. More to come. pic.twitter.com/VLn1998Obl AAGHarmeetDhillon (@AAGDhillon) May 4, 2025 The letter came in response to an April memo from Moriartys office that says prosecutors negotiating plea deals should consider the person charged as a whole person, including their racial identity and age and address racial disparities in the justice system. The memo pairs the racial and age considerations with an overall strategy to give defendants a nonincarceration option based on prosecutors individual analyses. While these factors should not be controlling, they should be part of the overall analysis, reads the memo. (RELATED: Prosecutor Under Fire Over Tesla Vandal Case Decides Its Time To Focus On Racial Disparities In Sentencing) The DOJs letter called the policy discriminatory. It also said Dhillon will lead a comprehensive review of all policies and practices at the office that may involve the illegal consideration of race in prosecutorial decision-making. The use of racial identity in prosecutorial decisions, including whether to depart from Sentencing Guidelines, is another example of how deeply Critical Race Theory has penetrated society, Cornell law professor William A. Jacobson told the Daily Caller News Foundation. Jacobson founded the Equal Protection Project, an initiative by the conservative Legal Insurrection Foundation. What once was a fringe academic theory has expanded from higher education into society, including the legal system, Jacobson said. Moriartys office did not immediately respond to a request for comment from the DCNF, nor has it responded to several other DCNF inquiries since April about Moriartys policies. A spokesperson told FOX9 KMSP that it will cooperate with any resulting investigation and were fully confident our policy complies with the law. Dhillon previously told the DCNF that she would return the DOJs Civil Rights Division to its traditional, core functions such as combatting race-preferential policies. She did not immediately respond to a request for comment. Employers that discriminate against people on the basis of race and use quotas in hiring that",https://dailycaller.com/2025/05/05/prosecutor-who-let-tesla-vandal-off-easy-now-under-doj-probe-for-race-based-policy/,2025-05-05 00:00:00,anger,The Department of Justice is looking into whether a Minnesota prosecutors office is violating the Constitution by pledging to factor defendants skin color into plea deals. Assistant Attorney General for Civil Rights Harmeet Dhillon announced on Saturday that the DOJ will review the new policy at Hennepin County Attorney Mary Moriartys office. The probe adds to ongoing scrutiny of Moriarty's policies since she came into the spotlight in April for refusing to prosecute a state official who vandalized Tesla vehicles.
The Times of India,"If Elon Musk quits as CEO, Tesla's valuation could drop by a massive 25%, warns Gary Black; here's a complete breakdown of what he said",,"Gary Black Reacts to Rumors of Elon Musks Departure From Tesla Im of the opinion that if @Elonmusk gave up his CEO role at $TSLA but continued in some role as Chief Technology Officer or Chief Product Officer, TSLA stock would fall by 5-10%. If Elon left TSLA altogether I believe TSLA stock would fall by 20-25%. For that reason I think pic.twitter.com/ZwJ62gEXSB Gary Black (@garyblack00) May 1, 2025 Live Events Elon Musk Replies to Rumors It is an EXTREMELY BAD BREACH OF ETHICS that the @WSJ would publish a DELIBERATELY FALSE ARTICLE and fail to include an unequivocal denial beforehand by the Tesla board of directors! gorklon rust (@elonmusk) May 1, 2025 More Tesla Bulls Weigh In FAQs (You can now subscribe to our (You can now subscribe to our Economic Times WhatsApp channel After speculation swirled around the potential for Tesla CEO Elon Musk to step down and replace him, a Tesla bull Gary Black, managing partner at The Future Fund LLC, was quick to shoot down the rumour, and also mentioned the consequences if this actually happens, as per a report.Black addressed this on social media platform X(previously Twitter), he wrote, ""Im of the opinion that if @Elonmusk gave up his CEO role at $TSLA but continued in some role as Chief Technology Officer or Chief Product Officer, TSLA stock would fall by 5-10%,"" as per his X post.Black went on to say, ""If Elon left TSLA altogether I believe TSLA stock would fall by 20-25%."" emphasizing that ""For that reason I think the odds are low that the Board chooses someone to replace him,"" as per his X post.For context, Musk has long been a key driver in Tesla's success and its market value. Tesla's market cap is now at $880 billion, and Musk's leadership is perceived as essential in keeping that value, as per Benzinga.Black's remarks came within hours after Musk himself reacted to the rumours in an X post. He responded to a Wall Street Journal report of his possible removal, terming it as an extremely bad breach of ethics and accusing it of being a deliberately false article, as per Musk's X post.Though Black's critique is severe, it's not so far out of line with other Tesla bulls. Dan Ives, a Wedbush Securities analyst, also commented on the rumours and opined that Musk will continue to be CEO for at least five years, as per Benzinga. Ives further opined that the rumours of Musk leaving might be nothing more than a ""warning shot"" by the board, according to Benzinga.There have been reports suggesting that Teslas board might be considering replacing Musk, as per Benzinga. However, Musk has denied it.Black suggested that Musks departure would result in a significant drop in Teslas stock, possibly wiping out $220 billion in shareholder value, as per Benzinga.",https://economictimes.indiatimes.com/news/international/us/if-elon-musk-quits-as-ceo-teslas-valuation-could-drop-by-a-massive-25-warns-gary-black-heres-a-complete-breakdown-of-what-he-said/articleshow/120904128.cms,,fear," speculation swirled around the potential for Tesla CEO Elon Musk to step down and replace him. Tesla bull Gary Black, managing partner at The Future Fund LLC, was quick to shoot down the rumour, and also mentioned the consequences. Gary Black Reacts to Rumors of Elon Musks Departure From Tesla Im of the opinion that if @Elonmusk gave up his CEO role at $TSLA but continued in some role as Chief Technology Officer or Chief Product Officer, TSLA stock would fall by 5-10%."
The Verge,"Waymo says it will add 2,000 more robotaxis into 2026",,"is transportation editor with 10+ years of experience who covers EVs, public transportation, and aviation. His work has appeared in The New York Daily News and City & State. Waymo said it recently received its last delivery of Jaguar I-Pace SUVs, which will be retrofitted with sensors and autonomous driving technology at its factory in Arizona, before joining its robotaxi fleet. In a blog post published today, the Alphabet company said it currently has 1,500 Jaguars operating across its four main markets: San Francisco, Los Angeles, Phoenix, and Austin. And it plans on adding 2,000 more vehicles into 2026, for a total fleet size of 3,500. The company recently hit an average of 250,000 paid passenger trips per week. Waymo typically doesnt like to comment on the size of its fleet, so todays announcement provides a rare glimpse into the number of robotaxis the company currently has in operation. Waymos plans to scale up comes as the company eyes Atlanta, Miami, and Washington, DC for launch in 2026. The Jaguar I-Pace has been the companys primary vehicle since Waymo retired its fleet of Chrysler Pacifica minivans in 2023. The company had once projected it would have 20,000 I-Paces operating as robotaxis, but appears to have fallen significantly short of that goal. Waymo is also currently testing and validating two new models, the Hyundai Ioniq 5 and the all-electric Zeekr RT minivan, but has yet to say when they will join the fleet. Waymo assembles its robotaxis with the help of auto engineering company Magna International at a 239,000 square-foot factory in Mesa, Arizona. The companys final batch of Jaguar I-Paces will be assembled there, which should carry Waymo through to next year. And starting in 2026, Waymo will begin work on its sixth generation Waymo Driver, which will launch in the Zeekr RT. Zeekr is a subsidiary of Geely, which is one of Chinas largest automakers. The new robotaxi is being designed in Sweden (where Geely owns Swedish carmaker Volvo), adapted from Geelys all-electric five-door Zeekr. Waymo is then importing the vehicles to Arizona, where they will be outfitted with the hardware and software necessary for autonomous driving. The first test vehicles began arriving in the US last year. In order to adapt to multiple vehicle platforms, Waymo says its Mesa factory will add automated assembly lines and other efficiencies over time. And when its operating at full capacity, the company expects it will be able to churn out tens of thousands of robotaxis each year. Waymo added new processes at the end of the assembly line for passenger validation and commission to ensure each vehicle is ready to accept riders as soon as it leaves the factory. Each vehicle drives itself into service after leaving the factory, where it is ready for passenger pickups within 30 minutes, according to Waymo spokesperson Chris Bonelli.",https://www.theverge.com/news/661025/waymo-fleet-size-factory-arizona-jaguar-robotaxi-zeekr,2025-05-05 15:10:23+00:00,neutral,"Waymo said it recently received its last delivery of Jaguar I-Pace SUVs, which will be retrofitted with sensors and autonomous driving technology. In a blog post published today, the Alphabet company said it currently has 1,500 Jaguars operating across its four main markets: San Francisco, Los Angeles, Phoenix, and Austin. And it plans on adding 2,000 more vehicles into 2026, for a total fleet size of 3,500. The company recently hit an average of 250,000 paid passenger trips per week."
Freerepublic.com,Tesla sparks firestorm after bold defense of self-driving tech: 'Car does it all for you',,"Skip to comments. Tesla sparks firestorm after bold defense of self-driving tech: 'Car does it all for you' Yahoo! / The Cool Down ^ | May 2, 2025 | Noah Jampol Posted on by ProtectOurFreedom Tesla is fighting back at criticism of its Full Self-Driving features. The EV automaker took to the social media platform X to provide a robust defense of FSD's current state and future. While few would take issue with this point, many consumers have been underwhelmed with FSD's view of autonomy thus far, due to the need for drivers to be attentive. Tesla pushed back, ""Although FSD Supervised currently does require your supervision, you will still notice that your commute or long drives are suddenly so much less taxing."" Teslarati added context, saying FSD ""has a ton of potential."" And there are supporters of FSD who have credited the feature with not only saving them from dangerous potential collisions, but also making often-stressful driving more pleasant. A Tesla owner in China shared remarkable footage showing FSD thriving in difficult conditions. Tesla laid out the selling points of FSD: ""No constant micro-adjustments in rush hour traffic. No frustration. Car does it all for you."" Not everyone has had the same experience with FSD, as there are drivers who anecdotally say the tech has made inexplicable maneuvers into traffic, and YouTuber Mark Rober went viral showing Tesla's Autopilot system, which relies on the same hardware as FSD, fail to stop the vehicle from crashing into a wall painted to look like additional road . Rober's criticism is that Tesla uses only cameras, albeit with great software, instead of including any radar or lidar detection. Tesla's China rollout also faced challenges with drivers getting fines as the result of system errors. Tesla is undeterred by these developments, as they are looking to go a step further by introducing Unsupervised FSD to Austin by June. Two of their Gigafactory locations already use the tech for operations, and through the criticism, Tesla is moving forward quickly. (Excerpt) Read more at tech.yahoo.com ... TOPICS: KEYWORDS: fsd tesla Click here: to donate by Credit Card Or here: to donate by PayPal Or by mail to: Free Republic, LLC - PO Box 9771 - Fresno, CA 93794 Thank you very much and God bless you. Early version of FSD being fooled... To: ProtectOurFreedom by 2 posted onby Salamander (Please visit my profile page to help me go home again. To: Salamander It it works I am all for it. As long as it is not mandated. The idea of leaving at night waking up hours closer your going is appealing. To: ProtectOurFreedom Self driving cars ... spam in a can To: ProtectOurFreedom Here in Austin, there are numerous Waymos-self driving cars. I hired one though Uber. It was a bit of a white knuckled ride solely due to my belief that the technology is not ready for prime time. I was wrong. It was a truly an amazing experience. As an added benefit, there were no tips and no AutoTune music. by 5 posted onby thegagline (Si",https://freerepublic.com/focus/f-news/4315126/posts,,surprise,"Tesla is fighting back at criticism of its Full Self-Driving features. The EV automaker took to the social media platform X to provide a robust defense of FSD's current state and future. Tesla pushed back, ""Although FSD Supervised currently does require your supervision, you will still notice that your commute or long drives are suddenly so much less taxing,"" Teslarati said. ""FSD has a ton of potential,"" he added, saying FSD ""has a lot of potential"""
