source,title,description,text,url,publishedAt,emotion,summary
Freerepublic.com,Black Leftist Moves to Africa and Discovers That America Isnt So Bad After All,,"Skip to comments. Black Leftist Moves to Africa and Discovers That America Isnt So Bad After All the liberty daily ^ | Zero Hedge Posted on by NoLibZone Millions of Americans, including those among the lowest income brackets, truly have no idea how good life is for them. The grass is always greener somewhere else in the world until people actually take the plunge and move to the neighbors house only to discover its crack den. The self hatred that progressives feel over being American and living in the US is a first-world luxury that few others can afford. Most of humanity doesnt have time to dwell obsessively on their nations global image; they are too busy barely surviving. The argument often regurgitated by over-privileged activists on Reddit forums and in college classrooms is that American exceptionalism is problematic because theres nothing exceptional about America. This claim is debunked by the fact that most of the rest of the world wants to come to the US and very few people want to leave. Those that do leave are usually among the wealthiest, or, they are gullible and think they can find something better overseas. It usually doesnt go well for them. One black leftist recently figured this out after moving to Africa. She assumed she would fit right in, but now says she actually prefers dealing with American racism over the scammers, grifters and of course, the lack of snacks. Her complaints have gone viral because they expose the common leftist delusion that the US is somehow one of the worst places on Earth. They simply dont understand how lucky they are until they step outside of their echo chamber. A minimal amount of research will drudge up numerous accounts similar to this one Most black Americans simply cannot assimilate after relocating to Africa and most Americans dont do well in regions devoid of western culture. The ultra-rich are fine wherever they go, but middle class expatriats have difficult experiences. Black comedians and celebrities have been trying to warn their community for decades about this. The venerable Patrice ONeil didnt mince words on the idea of going back to Africa. When confronting the issue of racism in America, it should be noted that most of the world treats Black Americans differently. Not necessarily because of skin color but because of their cultural habits and behaviors. Perhaps what black leftists in America interpret as racism is actually cultural burnout; a national or even global acknowledgment by other groups that they are tired of dealing with all the baggage that the black American community tends to bring with them? And if this is the case, then its unlikely that there are many other places in the world that will give them the time of day the way American society does. TOPICS: News/Current Events KEYWORDS: wakanda Click here: to donate by Credit Card Or here: to donate by PayPal Or by mail to: Free Republic, LLC - PO Box 9771 - Fresno, CA 93794 Thank you very much and God bless you. Name the na",https://freerepublic.com/focus/f-news/4315195/posts,,anger,The grass is always greener somewhere else in the world until people actually take the plunge and move to the neighbors house only to discover its crack den. The self hatred that progressives feel over being American and living in the US is a first-world luxury that few others can afford. The argument often regurgitated by over-privileged activists is that American exceptionalism is problematic because theres nothing exceptional about America. This claim is debunked by the fact that most of the rest of the world wants to come to the US and very few people want to leave.
Business Insider,4 of the best looks billionaires have worn to the Met Gala and 4 that missed the mark,,"lighning bolt icon An icon in the shape of a lightning bolt. lighning bolt icon An icon in the shape of a lightning bolt. Impact Link This story is available exclusively to Business Insider subscribers. Become an Insider and start reading now. What would the Met Gala be without billionaires? Each year, celebrities, athletes, business people, and more convene on the Metropolitan Museum of Art steps to enter the glamorous ball, which raises money for the Costume Institute. Many of those attendees also happen to have fortunes totaling billions of dollars. There's Kim Kardashian, Jeff Bezos, and Rihanna, just to name a few. Here's a look at some of the best looks those wealthy Met Gala guests have worn over the years, as well as a few that could have been better.",https://www.businessinsider.com/best-worst-looks-billionaires-have-worn-at-met-gala,,neutral,"Kim Kardashian, Jeff Bezos, and Rihanna have all attended the Met Gala. Many of those attendees have fortunes totaling billions of dollars."
Biztoc.com,Elon Musk took a chainsaw to the US government. Tesla is taking the hit,,"Elon Musk has long been credited with turning Tesla into a beacon of innovation, the visionary who pushed the world into an era of electrification. But his slide into politics specifically his alignment with President Trump and activities within the federal government has dragged This story appeared on techcrunch.com , 2025-05-05 19:50:06.",https://biztoc.com/x/2df26c4ef8042d8b,2025-05-05 19:50:06+00:00,neutral,Elon Musk has long been credited with turning Tesla into a beacon of innovation. But his slide into politics specifically his alignment with President Trump and activities within the federal government has dragged.
TechCrunch,Elon Musk took a chainsaw to the US government Tesla is taking the hit,,"Elon Musk has long been credited with turning Tesla into a beacon of innovation, the visionary who pushed the world into an era of electrification. But his slide into politics specifically his alignment with President Trump and activities within the federal government has dragged Tesla into uncertainty. For many would-be Tesla buyers, the brand has lost its progressive luster. And while Musk has long been the face of Tesla, that link has taken a negative turn as the billionaire oversees mass layoffs and the elimination of federal programs via the Department of Government Efficiency. Teslas disappointing first-quarter earnings, which saw profits drop 71% amid weakened sales and anti-Musk sentiment, demonstrate just how much the brand has fallen out of favor. The company reported 336,681 deliveries in the first three months of 2025, down from 495,570 in Q4 2024 and 386,810 in the first quarter of last year. Thats off the back of an unimpressive 2024, which saw fewer deliveries than the year prior amid production delays and increased EV competition. For many, Musks political activities have turned Tesla into a symbolic pariah. Tesla trade-ins have hit record highs, while sales in Europe have dropped. Foreign leaders are calling for boycotts and the automakers stock price has lost about half its value since December. All the while, protesters continue to assemble outside Tesla showrooms, dealerships, and even charging stations in an effort to accelerate the automakers brand devaluation and with it, they hope, Musks wealth. They have a certain significant public image problem thats really something we havent seen before in this industry, Sean Tucker, lead editor at Kelley Blue Book, told TechCrunch. Even one of Teslas most unwavering bulls, Dan Ives, has begged Musk to focus less on politics and more on his business or else unfortunately darker times are ahead for Tesla. And even though Musk said last month that hed take a step back from DOGE, hes not giving up on it either. To combat the effect this might have on Tesla, Musk has and likely will continue to lean on his sales pitch that Tesla isnt an automaker, its an AI company, one that will someday commercialize autonomous vehicles and humanoid robots. The question now is whether the Tesla brand can recover. Techcrunch event Exhibit at TechCrunch Sessions: AI Secure your spot at TC Sessions: AI and show 1,200+ decision-makers what youve built without the big spend. Available through May 9 or while tables last. Exhibit at TechCrunch Sessions: AI Secure your spot at TC Sessions: AI and show 1,200+ decision-makers what youve built without the big spend. Available through May 9 or while tables last. Berkeley, CA | BOOK NOW Below are the moments, which TechCrunch will continue to update, that are shaping perception of the Tesla brand and may have a lasting effect on its future. Drop in European sales Elon Musk Speaks at election campaign launch of AfD, Germanys far-right party. Image Credits:Hendrik Schm",https://techcrunch.com/2025/05/05/elon-musk-took-a-chainsaw-to-the-us-government-tesla-is-taking-the-hit/,2025-05-05 00:00:00,fear,"Elon Musk has long been credited with turning Tesla into a beacon of innovation. But his slide into politics specifically his alignment with President Trump and activities within the federal government has dragged Tesla into uncertainty. The company reported 336,681 deliveries in the first three months of 2025, down from 495,570 in Q4 2024 and 386,810 in first quarter of last year. Thats off the back of an unimpressive 2024, which saw fewer deliveries than the year prior amid productio."
ABC News,OpenAI says its nonprofit will continue to control its business,,"OpenAI is reversing course and said Monday its nonprofit will continue to control the business that makes ChatGPT and other artificial intelligence products After months spent pursuing a plan to convert itself into a for-profit business, OpenAI is reversing course and said Monday its nonprofit will continue to control the company that makes ChatGPT and other artificial intelligence products. We made the decision for the nonprofit to stay in control after hearing from civic leaders and having discussions with the offices of the Attorneys General of California and Delaware, said CEO Sam Altman in a letter to employees. Altman and the chair of OpenAIs nonprofit board, Bret Taylor, said the board made the decision for the nonprofit to retain control of OpenAI. The nonprofit already has a for-profit arm, but that arm will be converted into a public benefit corporation that has to consider the interests of both shareholders and the mission, Taylor said. OpenAIs co-founders, including Altman and Tesla CEO Musk, originally started it as a nonprofit research laboratory on a mission to safely build whats known as artificial general intelligence, or AGI, for humanitys benefit. Nearly a decade later, OpenAI has reported its market value as $300 billion and counts 400 million weekly users of ChatGPT, its flagship product. OpenAI first outlined plans last year to convert its core governance structure but faced a number of challenges. One is a lawsuit from Musk, who accuses the company and Altman of betraying the founding principles that led Musk to invest in the charity. A federal judge last week dismissed some of Musk's claims and allowed others to proceed to a trial set for next year. OpenAI also faced scrutiny from the top law enforcement officers in Delaware, where the company is incorporated, and California, where it operates out of a San Francisco headquarters.",https://abcnews.go.com/US/wireStory/openai-reverses-nonprofit-continue-control-business-121482166,,neutral,OpenAI is reversing course and said Monday its nonprofit will continue to control the company that makes ChatGPT and other artificial intelligence products. CEO Sam Altman: We made the decision for the nonprofit to stay in control after hearing from civic leaders and having discussions with the offices of the Attorneys General of California and Delaware.
Electrek,Chery is deploying an army of blonde humanoid robots called Mornine to sell its cars [Video],,"If you thought Tesla or XPengs bipedal humanoid robots were a creepy glimpse into the future, wait until you see what Chinese automaker Chery Automotive is deploying. Alongside business partner AiMOGA, Chery is encouraging its dealers to purchase a Mornine robot to help sell vehicles to customers. Mornine definitely wont scare anyone away, right? Chery Automotive has been developing vehicles for nearly 30 years in China and operates under the ownership of the Wuhu municipal government, where it is headquartered. Weve previously covered several of Cherys sub-brands, including Luxeed, and Omoda. In addition to cars, Chery has become yet another automaker exploring bipedal humanoid robots. In June 2024, Chery announced a strategic partnership with AI and robotics specialist AiMOGA to develop a new humanoid robot called Mornine, promising to usher in a wholly innovative customer ecosystem service system. Less than a year later, Mornine was strutting her stuff around Cherys booth at the Shanghai Auto Show before a crowd of the blonde robots stood behind Zhang Guibing, president of Chery International, during a dealer and media event in its home city of Wuhu. Advertisement - scroll for more content Wed argue that bipedal humanoid robots are already too close to a Terminator-like dystopia. Hence, adding hair and makeup (and some surprising junk in Mornines trunk) makes things a helluva lot more creepy. You have to listen to her speak in the video below. Source: Chery Automotive Cherys Mornine robot is awesome, but gives us the creeps While Mornine is new to us, the sunglass-clad, ponytailed robot from Chery and AiMOGA has been in the public eye for about a year now. It was only during Cherys recent press events, however, that we learned how Mornine is expected to support the automaker. She(?) will be your local showroom specialist, of course! According to Chery Internationals president, the market for humanoid robots has more potential in the future than vehicles, and AiMOGA is the real future for the Chery company. Zhang said Mornine is the same price as a car, but could serve as a home assistant, or you can buy a second robot to help you at work. However, personal robots are still more science fiction with an emphasis that leans more toward fiction, so Chery wants to get the word out about its technology and the use cases it can one day provide the world. To do so, Chery is hoping to deploy the Mornine robots to vehicle showrooms to assist customers in learning more about available models (see more in the video below). Those arent just cool shades AiMOGA equipped Mornine with they house surround-view vision. Mornine also has fully flexible hands that can serve customers drinks and female-like vocal capabilities to answer vehicle questions. Zhang told the crowd of over 3,000 in Wuhu that Chery would offer a discount on Mornine to any interested customers, although that amount was not publicly revealed. One Mornine robot has already been working on a tr",http://electrek.co/2025/05/05/chery-deploying-blonde-humanoid-robots-called-mornine-to-sell-cars-video/,2025-05-05 00:00:00,neutral,"Chery Automotive has partnered with AiMOGA to develop a bipedal humanoid robot called Mornine. Chery is encouraging its dealers to purchase a MORNine robot to help sell vehicles to customers. The automaker has been developing vehicles for nearly 30 years in China and operates under the ownership of the Wuhu municipal government, where it is headquartered. In June 2024, Chery announced a strategic partnership with AI and robotics specialist AiMogA. Less than a year later, Mornin was strutting her stuff around Cherys booth at the Shanghai Auto Show."
Biztoc.com,"Tesla Stock Falls On European Sales Decline, Rising Competition: What's Going On?",,"Tesla Inc. (NASDAQ:TSLA) shares are trading lower Monday after industry data showed a drop in new car sales in Spain, which appears to be adding to concerns over European performance. What To Know: New registration data from Spanish industry group ANFAC showed that Tesla sold 571 units This story appeared on benzinga.com , 2025-05-05 17:48:35.",https://biztoc.com/x/042183d99e09f415,2025-05-05 17:48:35+00:00,neutral,Tesla Inc. shares are trading lower Monday after industry data showed a drop in new car sales in Spain. New registration data from Spanish industry group ANFAC showed that Tesla sold 571 units.
The Times of India,"Europe pushes back against US tariffs, saying 'No thanks' to buying American",,"Live Events For motorcycle lovers in Sweden, Harley-Davidson is the hottest brand on the road. Jack Daniels whiskey beckons from the bar at British pubs. In France, Levis jeans are all about chic.But in the tumult of President Donald Trump 's trade war with Europe, many European consumers are starting to avoid US products and services in what appears to be a decisive and potentially long-term shift away from buying American, according to a new assessment by the European Central Bank In April, Trump imposed a 10% blanket tariff on America's trading partners and threatened ""reciprocal tariffs"" on many of those, including the European Union. Companies like Tesla and McDonald's are seeing customers in Europe put off by ""Made in America.""""The newly imposed US trade tariffs on European products are causing European consumers to think twice about what's in their shopping cart,"" the ECB wrote in a blog post about its research on consumer behavior. ""Consumers are very willing to actively move away from US products and services.""Europeans had already begun testing grassroots boycotts on American products, including Heinz ketchup and Lay's potato chips, shortly after Trump took office. His threats to take over Greenland, part of Denmark, energised Danes to organize no-buy campaigns on Facebook. Tesla owners in Sweden slapped ""shame"" bumper stickers on their cars to distance themselves from Elon Musk, the Tesla CEO who is one of Trump's top advisers.But Europeans' anguish over Trump's treatment of America's longtime allies has hardened as he has moved to rewire world trade with steep global tariffs, the central bank found.Trump took particular aim at the European Union, which he called ""very, very bad to us"" for not buying more from the United States, and threatened the bloc with a 20% ""reciprocal"" tariff last month. Such talk bewildered many Europeans and rattled EU leaders, who retaliated with a 25% duty on many U.S. goods.Both sides called a temporary truce after Trump abruptly reversed course and delayed tariffs until the summer. But the 10% baseline tariff is still in place, and a trans-Atlantic trade war could easily flare again.And even if a trade deal is reached, Europe's newfound wariness of its longtime ally will not easily be unwound. The ECB study found that even if a mere 5% tax were placed on American products sold in Europe, Europeans would still be inclined to shun them.What is new, the central bank said, is a ""preference"" among European consumers ""to move away from U.S. products and brands altogether,"" no matter what the cost. That was the case even for households that could bear the brunt of higher prices.""Even though they could afford more expensive U.S. products and services, they consciously choose alternatives,"" the bank said. ""This suggests that consumers' reactions may not just be a temporary response to tariff increases, but instead signal a possible long-term structural shift in consumer preferences away from U.S. products and brand",https://economictimes.indiatimes.com/tech/technology/europe-pushes-back-against-us-tariffs-saying-no-thanks-to-buying-american/articleshow/120906620.cms,,fear,"European consumers are starting to avoid US products and services, ECB says. In April, President Donald Trump imposed a 10% blanket tariff on America's trading partners. Companies like Tesla and McDonald's are seeing customers in Europe put off by ""Made in America"" ""The newly imposed US trade tariffs on European products are causing European consumers to think twice about what's in their shopping cart,"" the ECB wrote in a blog post about its research on consumer behavior. ""Consumers are very willing to actively move away from US products,"" it added."
Biztoc.com,"Tesla (NASDAQ: TSLA) Bull, Base, & Bear Price Prediction and Forecast",,"Shares of Tesla Inc. (NASDAQ:TSLA) may be catching the eye of investors looking for a buy-low opportunity, but if that includes you, proceed with caution. Since reaching its all-time high of $479.86 on Dec. 17, 2024, the stock has plummeted 42.18%, including a loss of 35.19% since This story appeared on 247wallst.com , 2025-05-05 16:23:26.",https://biztoc.com/x/eeb62b39c9fb6dd0,2025-05-05 16:23:26+00:00,fear,"Since reaching its all-time high of $479.86 on Dec. 17, 2024, the stock has plummeted 42.18%, including a loss of 35.19% since."
The Times of India,"S&P 500, Nasdaq slip after Trump's fresh tariffs at start of Fed-decision week",,"Live Events (You can now subscribe to our (You can now subscribe to our ETMarkets WhatsApp channel The S&P 500 and the Nasdaq were lower on Monday after U.S. President Donald Trump rekindled worries about the fallout of a global trade war by introducing new tariffs, while focus remained on the Federal Reserve 's monetary policy decision later this week.On Sunday, Trump announced a 100% tariff on movies produced outside the U.S. but offered little clarity on how the levies would be implemented.Several movie and television production companies took a hit. Netflix fell 2.1% and was set to snap an 11-session winning streak, while Amazon.com was down 1.2%. Paramount Global slipped 1%.However, the top indexes were well above their session lows, as investors hoped for some reprieve on the trade tariff front with negotiation talks underway.""The market has a slight positive lean towards it right now, believing that these trade tariffs are either going to be reduced or they're going to come to some type of an agreement,"" said Robert Pavlik, senior portfolio manager at Dakota Wealth.Markets were also taking a pause after the S&P 500 notched its ninth session of gains on Friday, a streak last seen in 2004.At 11:30 a.m. ET, the Dow Jones Industrial Average rose 26.93 points, or 0.07%, to 41,344.36, the S&P 500 lost 21.19 points, or 0.37%, to 5,665.48 and the Nasdaq Composite lost 93.56 points, or 0.52%, to 17,884.17.Most megacap stocks were lower, with Tesla and Apple down over 3% each, while gains in some financial stocks buoyed the Dow.Energy stocks were the biggest loser, down 1.7% as crude prices dropped on anticipation of increased supply by OPEC+ countries.Class B shares of Berkshire Hathaway were down 4.4% after Warren Buffett said he will step down as CEO of the conglomerate. The stock pressured the S&P 500 financials sector .Meanwhile, an ISM survey showed services sector's growth picked up in April as orders increased and indicated a buildup in inflation pressures.The spotlight will be on the Fed this week, which is widely expected to keep interest rates on hold. Investors will closely monitor the commentary from central bank policymakers to gauge their approach to monetary policy easing this year amid tariff impacts.Traders are pricing in 25 basis points of easing by the Fed by July, and see a total of 80 points of cuts by the end of the year, according to data compiled by LSEG.On the earnings front, investor attention is on how companies are navigating tariff-induced uncertainty.Tyson Foods dropped 9.2% after the meat packer missed quarterly revenue expectations.U.S.-listed shares of gold miners Gold Fields Ltd and Anglogold Ashanti gained 8% and 4.5%, respectively, tracking higher gold prices.Skechers jumped about 25% after the footwear maker agreed to be taken private by 3G Capital in a $9.4 billion deal.Declining issues outnumbered advancers by a 1.17-to-1 ratio on the NYSE and by a 1.23-to-1 ratio on the Nasdaq.The S&P 500 posted seven new 52-",https://economictimes.indiatimes.com/markets/stocks/news/sp-500-nasdaq-slip-after-trumps-fresh-tariffs-at-start-of-fed-decision-week/articleshow/120905512.cms,,fear,"The S&P 500 and the Nasdaq were lower on Monday. U.S. President Donald Trump rekindled worries about the fallout of a global trade war by introducing new tariffs. Netflix fell 2.1% and was set to snap an 11-session winning streak. Amazon.com was down 1.2%. Paramount Global slipped 1%. However, the top indexes were well above their session lows, as investors hoped for some reprieve on the trade tariff front with negotiation talks underway."
